{
  "artifact_id": "01930a9c-1000-7000-8000-00000000000a",
  "artifact_type": "transcript",
  "schema_version": 1,
  "media_type": "application/json",
  "digest": {
    "algorithm": "sha256",
    "value": "aaaaaaaaaaaaaaaaaaaaaaaaaaaaaaaaaaaaaaaaaaaaaaaaaaaaaaaaaaaaaaaa"
  },
  "byte_size": 184320,
  "created_at": "2026-10-03T09:40:12Z",
  "client_scope": {
    "scope": "client",
    "client_id": "01930a9c-1000-7000-8000-000000000001"
  },
  "retention_class": "participant_personal"
}
