{
  "artifact_id": "01930a9c-1000-7000-8000-00000000000a",
  "artifact_type": "case_file_core",
  "schema_version": 2,
  "media_type": "application/json; charset=utf-8",
  "digest": {
    "algorithm": "sha256",
    "value": "bbbbbbbbbbbbbbbbbbbbbbbbbbbbbbbbbbbbbbbbbbbbbbbbbbbbbbbbbbbbbbbb"
  },
  "byte_size": 0,
  "created_at": "2026-10-03T11:02:00.500Z",
  "client_scope": {
    "scope": "client",
    "client_id": "01930a9c-1000-7000-8000-000000000001"
  },
  "retention_class": "client_evidence"
}
